{
  "attempt_id": "base-attempt-001",
  "checks": [
    {
      "evidence": "All 4 categories are represented.",
      "id": "ignore-rules-cover-categories",
      "outcome": "pass",
      "summary": "Ignore rules cover generated output, local data, environment files and credentials."
    },
    {
      "artifact": "participant/evidence/base-camp-repository-safety/base-attempt-001/PROOF.md",
      "evidence": "All 5 questions are addressed.",
      "id": "proof-answers-reviewer-questions",
      "outcome": "pass",
      "summary": "The proof document answers the questions a reviewer will ask."
    },
    {
      "evidence": "Pattern detection is a safety net, not a guarantee.",
      "id": "evidence-carries-no-secrets",
      "outcome": "pass",
      "summary": "No secret-like value was found in the evidence."
    }
  ],
  "completed_at": "2026-10-21T15:21:01Z",
  "duration_ms": 96,
  "environment": {
    "network": "denied",
    "validator_version": 2
  },
  "outcome": "pass",
  "quest_id": "base-camp-repository-safety",
  "redaction_applied": false,
  "result_path": "participant/evidence/base-camp-repository-safety/base-attempt-001/validation/validate-repository-foundation-20261021152101174306-631eda.json",
  "run_id": "validate-repository-foundation-20261021152101174306-631eda",
  "schema_version": 1,
  "started_at": "2026-10-21T15:21:01Z",
  "validator_id": "validate-repository-foundation",
  "validator_version": 2
}
