{
  "attempt_id": "base-attempt-001",
  "checks": [
    {
      "evidence": "All 4 categories are represented.",
      "id": "ignore-rules-cover-categories",
      "outcome": "pass",
      "summary": "Ignore rules cover generated output, local data, environment files and credentials."
    },
    {
      "artifact": "participant/evidence/base-camp-repository-safety/base-attempt-001/PROOF.md",
      "evidence": "Every heading is there, with nothing written under any of them.",
      "id": "proof-answers-reviewer-questions",
      "outcome": "fail",
      "severity": "medium",
      "suggested_action": "Say what you actually did under each heading.",
      "summary": "The proof document is still the empty template."
    },
    {
      "evidence": "Pattern detection is a safety net, not a guarantee.",
      "id": "evidence-carries-no-secrets",
      "outcome": "pass",
      "summary": "No secret-like value was found in the evidence."
    }
  ],
  "completed_at": "2026-10-14T17:21:56Z",
  "duration_ms": 61,
  "environment": {
    "network": "denied",
    "validator_version": 2
  },
  "outcome": "fail",
  "quest_id": "base-camp-repository-safety",
  "redaction_applied": false,
  "result_path": "participant/evidence/base-camp-repository-safety/base-attempt-001/validation/validate-repository-foundation-20261014172156037086-c84175.json",
  "run_id": "validate-repository-foundation-20261014172156037086-c84175",
  "schema_version": 1,
  "started_at": "2026-10-14T17:21:56Z",
  "validator_id": "validate-repository-foundation",
  "validator_version": 2
}
